{
  "schema": "pi.ext.catalog.v1",
  "generated_at": "2026-02-07T06:12:52Z",
  "total_extensions": 223,
  "tier_summary": {
    "agents-mikeastock": 1,
    "community": 58,
    "npm-registry": 75,
    "official_examples": 66,
    "third-party-github": 23
  },
  "runtime_summary": {
    "legacy-js": 129,
    "multi-file": 57,
    "pkg-with-deps": 37
  },
  "items": [
    {
      "id": "agents-mikeastock/extensions",
      "name": "index.ts",
      "source_tier": "agents-mikeastock",
      "source": {
        "type": "git",
        "repo": "unknown",
        "path": "agents-mikeastock/extensions/pi/AskUserQuestion/index.ts"
      },
      "runtime_tier": "multi-file",
      "interaction_tags": [
        "tool_only",
        "event_hook",
        "shortcut"
      ],
      "capabilities": [
        "event_hook",
        "exec",
        "shortcut",
        "tool"
      ],
      "io_pattern": [],
      "complexity": "medium",
      "file_count": 2,
      "total_bytes": 0,
      "checksum": {
        "sha256": "60e05bd1b195af2f94112fa7197a5c88289058840ce7c6df9693756bc6250f55"
      },
      "compatibility_notes": {
        "conformance_status": "fail",
        "conformance_tier": 5,
        "failure_category": "missing_command",
        "failure_reason": "Missing command 'handoff'. Actual: []"
      },
      "perf_budgets": {
        "cold_load_ms": 105
      }
    },
    {
      "id": "antigravity-image-gen",
      "name": "antigravity-image-gen.ts",
      "source_tier": "official_examples",
      "source": {
        "type": "git",
        "repo": "https://github.com/badlogic/pi-mono",
        "path": "packages/coding-agent/examples/extensions/antigravity-image-gen.ts"
      },
      "runtime_tier": "legacy-js",
      "interaction_tags": [
        "tool_only"
      ],
      "capabilities": [
        "env",
        "http",
        "read",
        "tool",
        "write"
      ],
      "io_pattern": [
        "fs-heavy",
        "network-heavy"
      ],
      "complexity": "large",
      "file_count": 1,
      "total_bytes": 12549,
      "checksum": {
        "sha256": "3c383d17632154edd17b3d5322d64d6feefb596bdf09e71026c77ec1fa493924"
      },
      "compatibility_notes": {
        "conformance_status": "pass",
        "conformance_tier": 1
      },
      "perf_budgets": {
        "cold_load_ms": 82
      }
    },
    {
      "id": "auto-commit-on-exit",
      "name": "auto-commit-on-exit.ts",
      "source_tier": "official_examples",
      "source": {
        "type": "git",
        "repo": "https://github.com/badlogic/pi-mono",
        "path": "packages/coding-agent/examples/extensions/auto-commit-on-exit.ts"
      },
      "runtime_tier": "legacy-js",
      "interaction_tags": [
        "ui_integration"
      ],
      "capabilities": [
        "exec",
        "ui"
      ],
      "io_pattern": [
        "ui-centric",
        "os-heavy"
      ],
      "complexity": "small",
      "file_count": 1,
      "total_bytes": 1569,
      "checksum": {
        "sha256": "6b915e8a0da9984f85755392adde2db028668c922252733662bd7fa2ed72d47c"
      },
      "compatibility_notes": {
        "conformance_status": "pass",
        "conformance_tier": 2
      },
      "perf_budgets": {
        "cold_load_ms": 68
      }
    },
    {
      "id": "base_fixtures",
      "name": "index.ts",
      "source_tier": "official_examples",
      "source": {
        "type": "git",
        "repo": "unknown",
        "path": "base_fixtures/minimal_command/index.ts"
      },
      "runtime_tier": "multi-file",
      "interaction_tags": [
        "tool_only",
        "event_hook",
        "provider",
        "shortcut"
      ],
      "capabilities": [
        "event_hook",
        "provider",
        "shortcut",
        "tool"
      ],
      "io_pattern": [],
      "complexity": "medium",
      "file_count": 2,
      "total_bytes": 0,
      "checksum": {
        "sha256": "60e05bd1b195af2f94112fa7197a5c88289058840ce7c6df9693756bc6250f55"
      },
      "compatibility_notes": {
        "conformance_status": "fail",
        "conformance_tier": 3,
        "failure_category": "missing_tool",
        "failure_reason": "Manifest expects tools but none registered"
      },
      "perf_budgets": {
        "cold_load_ms": 69
      }
    },
    {
      "id": "bash-spawn-hook",
      "name": "bash-spawn-hook.ts",
      "source_tier": "official_examples",
      "source": {
        "type": "git",
        "repo": "https://github.com/badlogic/pi-mono",
        "path": "packages/coding-agent/examples/extensions/bash-spawn-hook.ts"
      },
      "runtime_tier": "legacy-js",
      "interaction_tags": [
        "tool_only"
      ],
      "capabilities": [
        "exec",
        "tool"
      ],
      "io_pattern": [
        "os-heavy"
      ],
      "complexity": "small",
      "file_count": 1,
      "total_bytes": 692,
      "checksum": {
        "sha256": "dc125f3c69b0da8e452dfa85b45b170be5114b4021e34c8de8e7a5c31f365ed3"
      },
      "compatibility_notes": {
        "conformance_status": "pass",
        "conformance_tier": 1
      },
      "perf_budgets": {
        "cold_load_ms": 68
      }
    },
    {
      "id": "bookmark",
      "name": "bookmark.ts",
      "source_tier": "official_examples",
      "source": {
        "type": "git",
        "repo": "https://github.com/badlogic/pi-mono",
        "path": "packages/coding-agent/examples/extensions/bookmark.ts"
      },
      "runtime_tier": "legacy-js",
      "interaction_tags": [
        "ui_integration"
      ],
      "capabilities": [
        "ui"
      ],
      "io_pattern": [
        "ui-centric"
      ],
      "complexity": "small",
      "file_count": 1,
      "total_bytes": 1553,
      "checksum": {
        "sha256": "e1f9c32e3e49f39ff3c3b788e3e5e507fde21e3e785b8227bfc019c86d008952"
      },
      "compatibility_notes": {
        "conformance_status": "pass",
        "conformance_tier": 1
      },
      "perf_budgets": {
        "cold_load_ms": 72
      }
    },
    {
      "id": "claude-rules",
      "name": "claude-rules.ts",
      "source_tier": "official_examples",
      "source": {
        "type": "git",
        "repo": "https://github.com/badlogic/pi-mono",
        "path": "packages/coding-agent/examples/extensions/claude-rules.ts"
      },
      "runtime_tier": "legacy-js",
      "interaction_tags": [
        "ui_integration"
      ],
      "capabilities": [
        "ui"
      ],
      "io_pattern": [
        "ui-centric"
      ],
      "complexity": "medium",
      "file_count": 1,
      "total_bytes": 2486,
      "checksum": {
        "sha256": "59b1c0aad64a423e7cd3d6e084b45b3c84cf8080b9485524a877886fd9870c97"
      },
      "compatibility_notes": {
        "conformance_status": "pass",
        "conformance_tier": 2
      },
      "perf_budgets": {
        "cold_load_ms": 71
      }
    },
    {
      "id": "community/ferologics-notify",
      "name": "index.ts",
      "source_tier": "community",
      "source": {
        "type": "git",
        "repo": "unknown",
        "path": "community/ferologics-notify/index.ts"
      },
      "runtime_tier": "legacy-js",
      "interaction_tags": [
        "event_hook"
      ],
      "capabilities": [
        "event_hook",
        "exec"
      ],
      "io_pattern": [],
      "complexity": "small",
      "file_count": 1,
      "total_bytes": 0,
      "checksum": {
        "sha256": "60e05bd1b195af2f94112fa7197a5c88289058840ce7c6df9693756bc6250f55"
      },
      "compatibility_notes": {
        "conformance_status": "pass",
        "conformance_tier": 2
      },
      "perf_budgets": {
        "cold_load_ms": 73
      }
    },
    {
      "id": "community/hjanuschka-clipboard",
      "name": "clipboard.ts",
      "source_tier": "community",
      "source": {
        "type": "git",
        "repo": "unknown",
        "path": "community/hjanuschka-clipboard/clipboard.ts"
      },
      "runtime_tier": "legacy-js",
      "interaction_tags": [
        "tool_only"
      ],
      "capabilities": [
        "tool"
      ],
      "io_pattern": [],
      "complexity": "small",
      "file_count": 1,
      "total_bytes": 0,
      "checksum": {
        "sha256": "60e05bd1b195af2f94112fa7197a5c88289058840ce7c6df9693756bc6250f55"
      },
      "compatibility_notes": {
        "conformance_status": "pass",
        "conformance_tier": 1
      },
      "perf_budgets": {
        "cold_load_ms": 69
      }
    },
    {
      "id": "community/hjanuschka-cost-tracker",
      "name": "cost-tracker.ts",
      "source_tier": "community",
      "source": {
        "type": "git",
        "repo": "unknown",
        "path": "community/hjanuschka-cost-tracker/cost-tracker.ts"
      },
      "runtime_tier": "legacy-js",
      "interaction_tags": [
        "shortcut"
      ],
      "capabilities": [
        "shortcut"
      ],
      "io_pattern": [],
      "complexity": "small",
      "file_count": 1,
      "total_bytes": 0,
      "checksum": {
        "sha256": "60e05bd1b195af2f94112fa7197a5c88289058840ce7c6df9693756bc6250f55"
      },
      "compatibility_notes": {
        "conformance_status": "pass",
        "conformance_tier": 1
      },
      "perf_budgets": {
        "cold_load_ms": 80
      }
    },
    {
      "id": "community/hjanuschka-flicker-corp",
      "name": "flicker-corp.ts",
      "source_tier": "community",
      "source": {
        "type": "git",
        "repo": "unknown",
        "path": "community/hjanuschka-flicker-corp/flicker-corp.ts"
      },
      "runtime_tier": "legacy-js",
      "interaction_tags": [
        "shortcut"
      ],
      "capabilities": [
        "shortcut"
      ],
      "io_pattern": [],
      "complexity": "small",
      "file_count": 1,
      "total_bytes": 0,
      "checksum": {
        "sha256": "60e05bd1b195af2f94112fa7197a5c88289058840ce7c6df9693756bc6250f55"
      },
      "compatibility_notes": {
        "conformance_status": "pass",
        "conformance_tier": 1
      },
      "perf_budgets": {
        "cold_load_ms": 72
      }
    },